{
  "schema": "shredator.machine.v1",
  "type": "summary",
  "success": true,
  "status": "completed",
  "exit_code": 0,
  "duration_ms": 18,
  "output_format": "json",
  "summary": {
    "files_shredded": 1,
    "directories_removed": 0,
    "paths_successful": 1,
    "paths_failed": 0,
    "paths_skipped": 0,
    "bytes_seen": 1024,
    "bytes_overwritten": 3072,
    "overwrite_passes_completed": 3,
    "warnings": 0,
    "errors": 0
  },
  "events": [
    {
      "type": "event",
      "level": "info",
      "event": "file_start_requested",
      "message": "Shredding file: ./secret.txt (using 3 passes)",
      "path": "./secret.txt",
      "passes": 3,
      "pattern": "random"
    }
  ]
}
